{
 "id": "vessel-boat",
 "name": "Boat",
 "system": "openfrp74",
 "oared_slow": 10,
 "oared_cruise": 15,
 "oared_fast": 20,
 "sail_running": "15/20",
 "sail_broad_reaching": "12/17",
 "sail_quarter_reaching": "10/15",
 "sail_beating": "5/10",
 "crew": null,
 "hit_points": "3",
 "description": "The all-purpose small craft.",
 "notes": [
  "swamp movement 5 (v3-p16 table)"
 ],
 "source": {
  "work": "OpenFRP74",
  "booklet": "v3",
  "page": "p28",
  "blocks": [
   7
  ],
  "content_sha256": [
   "02ae9e56c2dd21fa8f92baf594875562fb4906a1f81b2ac361b18f1dd88fdb83"
  ],
  "also": [
   {
    "booklet": "v3",
    "page": "p33",
    "blocks": [
     12,
     13
    ],
    "content_sha256": [
     "168de4ddb00406d49e9a5990844ae1401f368d0b1842c33124eba432525c82cd",
     "253e001740b3502ac375a83652e04aa1cc172471a8edb20cfdfbaf412c33a245"
    ],
    "note": "crew numbers + catapult footnotes"
   },
   {
    "booklet": "v3",
    "page": "p30",
    "blocks": [
     4
    ],
    "content_sha256": [
     "0602b91795f21a74e8dda7633948984310dc1818a5122a8368da00cec68d2175"
    ],
    "note": "hit points by size"
   }
  ]
 },
 "extraction": {
  "date": "2026-07-17",
  "model": "claude-opus-4-8",
  "notes": null
 }
}
